{
  "version": "1.0",
  "binary": "yai",
  "defaults": {
    "ws_flag": "--ws",
    "ws_default_source": "config"
  },
  "exit_codes": {
    "0": "success",
    "1": "generic_failure",
    "2": "invalid_arguments_or_contract_violation",
    "3": "dependency_missing",
    "4": "runtime_not_ready"
  },
  "commands": [
    {
      "id": "yai.lifecycle.up",
      "name": "up",
      "group": "lifecycle",
      "summary": "Start stack: boot + engine + mind",
      "args": [
        { "name": "ws", "flag": "--ws", "type": "string", "required": false },
        { "name": "build", "flag": "--build", "type": "bool", "required": false, "default": false },
        { "name": "ai", "flag": "--ai", "type": "bool", "required": false, "default": false },
        { "name": "no_engine", "flag": "--no-engine", "type": "bool", "required": false, "default": false },
        { "name": "no_mind", "flag": "--no-mind", "type": "bool", "required": false, "default": false },
        { "name": "detach", "flag": "--detach", "type": "bool", "required": false, "default": false },
        { "name": "monitor", "flag": "--monitor", "type": "bool", "required": false, "default": false },
        { "name": "timeout_ms", "flag": "--timeout-ms", "type": "int", "required": false }
      ],
      "outputs": ["text", "json"],
      "side_effects": ["spawn_processes", "write_session", "write_logs", "create_socket", "rpc_call"],
      "law_hooks": ["I-001", "I-002", "I-006", "L1", "L2", "L3"],
      "law_invariants": ["I-001-traceability", "I-002-determinism", "I-006-external-effect-boundary"],
      "law_boundaries": ["L1-kernel", "L2-engine", "L3-mind"],
      "uses_primitives": ["O-004", "O-005", "S-016", "S-023", "S-026", "S-029", "T-012"],
      "emits_artifacts": [],
      "consumes_artifacts": []
    },
    {
      "id": "yai.lifecycle.restart",
      "name": "restart",
      "group": "lifecycle",
      "summary": "Restart stack for a workspace",
      "args": [
        { "name": "ws", "flag": "--ws", "type": "string", "required": false },
        { "name": "build", "flag": "--build", "type": "bool", "required": false, "default": false },
        { "name": "ai", "flag": "--ai", "type": "bool", "required": false, "default": false },
        { "name": "no_engine", "flag": "--no-engine", "type": "bool", "required": false, "default": false },
        { "name": "no_mind", "flag": "--no-mind", "type": "bool", "required": false, "default": false },
        { "name": "detach", "flag": "--detach", "type": "bool", "required": false, "default": false },
        { "name": "monitor", "flag": "--monitor", "type": "bool", "required": false, "default": false },
        { "name": "timeout_ms", "flag": "--timeout-ms", "type": "int", "required": false },
        { "name": "force", "flag": "--force", "type": "bool", "required": false, "default": false }
      ],
      "outputs": ["text", "json"],
      "side_effects": ["signal_processes", "spawn_processes", "write_session", "write_logs", "create_socket", "rpc_call"],
      "law_hooks": ["I-001", "I-002", "I-006", "L1", "L2", "L3"],
      "law_invariants": ["I-001-traceability", "I-002-determinism", "I-006-external-effect-boundary"],
      "law_boundaries": ["L1-kernel", "L2-engine", "L3-mind"],
      "uses_primitives": ["O-004", "O-005", "S-016", "S-023", "S-026", "S-029", "T-012"],
      "emits_artifacts": [],
      "consumes_artifacts": []
    },
    {
      "id": "yai.lifecycle.down",
      "name": "down",
      "group": "lifecycle",
      "summary": "Stop stack and cleanup runtime artifacts",
      "args": [
        { "name": "ws", "flag": "--ws", "type": "string", "required": false },
        { "name": "force", "flag": "--force", "type": "bool", "required": false, "default": false }
      ],
      "outputs": ["text", "json"],
      "side_effects": ["signal_processes", "remove_session", "remove_socket", "rpc_call"],
      "law_hooks": ["I-001", "I-006", "L1", "L2", "L3"],
      "law_invariants": ["I-001-traceability", "I-006-external-effect-boundary"],
      "law_boundaries": ["L1-kernel", "L2-engine", "L3-mind"],
      "uses_primitives": ["O-004", "S-016", "S-023", "S-026", "T-012"],
      "emits_artifacts": [],
      "consumes_artifacts": []
    },
    {
      "id": "yai.inspect.status",
      "name": "status",
      "group": "inspect",
      "summary": "Show runtime status (pids, socket, vault readiness)",
      "args": [
        { "name": "ws", "flag": "--ws", "type": "string", "required": false },
        { "name": "json", "flag": "--json", "type": "bool", "required": false, "default": false }
      ],
      "outputs": ["text", "json"],
      "side_effects": [],
      "law_hooks": ["I-001", "L1", "L2", "L3"],
      "law_invariants": ["I-001-traceability"],
      "law_boundaries": ["L1-kernel", "L2-engine", "L3-mind"],
      "uses_primitives": ["S-026", "S-016", "S-002"],
      "emits_artifacts": [],
      "consumes_artifacts": []
    },
    {
      "id": "yai.inspect.logs",
      "name": "logs",
      "group": "inspect",
      "summary": "Tail logs for a component",
      "args": [
        {
          "name": "component",
          "pos": 1,
          "type": "enum",
          "values": ["boot", "engine", "mind", "kernel"],
          "required": true
        },
        { "name": "ws", "flag": "--ws", "type": "string", "required": false },
        { "name": "follow", "flag": "--follow", "type": "bool", "required": false, "default": false }
      ],
      "outputs": ["text"],
      "side_effects": [],
      "law_hooks": ["I-001"],
      "law_invariants": ["I-001-traceability"],
      "law_boundaries": [],
      "uses_primitives": ["S-016", "S-022"],
      "emits_artifacts": [],
      "consumes_artifacts": []
    },
    {
      "id": "yai.inspect.monitor",
      "name": "monitor",
      "group": "inspect",
      "summary": "Live monitor (event stream) for a workspace",
      "args": [
        { "name": "ws", "flag": "--ws", "type": "string", "required": false }
      ],
      "outputs": ["text"],
      "side_effects": ["rpc_call"],
      "law_hooks": ["I-001", "L1", "L2", "L3"],
      "law_invariants": ["I-001-traceability"],
      "law_boundaries": ["L1-kernel", "L2-engine", "L3-mind"],
      "uses_primitives": ["S-016", "S-022", "S-010", "T-001"],
      "emits_artifacts": [],
      "consumes_artifacts": []
    },
    {
      "id": "yai.inspect.events",
      "name": "events",
      "group": "inspect",
      "summary": "Stream daemon events (NDJSON)",
      "args": [
        { "name": "ws", "flag": "--ws", "type": "string", "required": false }
      ],
      "outputs": ["text"],
      "side_effects": ["rpc_call"],
      "law_hooks": ["I-001", "L1", "L2", "L3"],
      "law_invariants": ["I-001-traceability"],
      "law_boundaries": ["L1-kernel", "L2-engine", "L3-mind"],
      "uses_primitives": ["S-016", "S-022", "S-010", "T-001"],
      "emits_artifacts": [],
      "consumes_artifacts": []
    },
    {
      "id": "yai.verify.verify",
      "name": "verify",
      "group": "verify",
      "summary": "Run verification gates",
      "args": [
        { "name": "target", "pos": 1, "type": "enum", "values": ["core", "full"], "required": true }
      ],
      "outputs": ["text", "json"],
      "side_effects": ["spawn_processes", "run_scripts"],
      "law_hooks": ["I-003", "I-001", "Lx"],
      "law_invariants": ["I-003-governance", "I-001-traceability"],
      "law_boundaries": ["Lx-docs"],
      "uses_primitives": ["T-015", "T-014", "S-008", "S-014", "O-007"],
      "emits_artifacts": [
        {
          "role": "verification_report",
          "schema_ref": "law/abi/artifacts-schema/verification_report.v1.schema.json",
          "path_hint": "verify/report.json"
        }
      ],
      "consumes_artifacts": [
        {
          "role": "bundle",
          "schema_ref": "law/abi/artifacts-schema/bundle_manifest.v1.schema.json",
          "path_hint": "bundle/**"
        }
      ]
    },
    {
      "id": "yai.verify.test",
      "name": "test",
      "group": "verify",
      "summary": "Run test gates",
      "args": [
        { "name": "target", "pos": 1, "type": "enum", "values": ["smoke"], "required": true },
        { "name": "ws", "flag": "--ws", "type": "string", "required": false },
        { "name": "timeout_ms", "flag": "--timeout-ms", "type": "int", "required": false }
      ],
      "outputs": ["text", "json"],
      "side_effects": ["spawn_processes"],
      "law_hooks": ["I-001", "L1", "L2", "L3"],
      "law_invariants": ["I-001-traceability"],
      "law_boundaries": ["L1-kernel", "L2-engine", "L3-mind"],
      "uses_primitives": ["O-009", "S-026", "S-016", "T-012"],
      "emits_artifacts": [],
      "consumes_artifacts": []
    },
    {
      "id": "yai.control.providers",
      "name": "providers",
      "group": "control",
      "summary": "Provider lifecycle (discover/pair/attach/detach/status)",
      "args": [
        {
          "name": "subcommand",
          "pos": 1,
          "type": "enum",
          "values": ["discover", "list", "trust", "pair", "attach", "detach", "revoke", "status"],
          "required": true
        },
        { "name": "ws", "flag": "--ws", "type": "string", "required": false }
      ],
      "outputs": ["text", "json"],
      "side_effects": ["rpc_call", "write_trust", "write_session"],
      "law_hooks": ["I-001", "L3"],
      "law_invariants": ["I-001-traceability"],
      "law_boundaries": ["L3-mind"],
      "uses_primitives": ["S-006", "S-005", "S-016", "T-002", "T-003"],
      "emits_artifacts": [],
      "consumes_artifacts": []
    },
    {
      "id": "yai.control.dsar",
      "name": "dsar",
      "group": "control",
      "summary": "DSAR workflow (request/status/execute)",
      "args": [
        { "name": "subcommand", "pos": 1, "type": "enum", "values": ["request", "status", "execute"], "required": true },
        { "name": "ws", "flag": "--ws", "type": "string", "required": false }
      ],
      "outputs": ["text", "json"],